song,link,album,year,artist
What About Me,../lyrics/annemurray/whataboutme.html,What About Me,1968,a_annemurray.html
Both Sides Now,../lyrics/annemurray/bothsidesnow.html,What About Me,1968,a_annemurray.html
Paths Of Victory,../lyrics/annemurray/pathsofvictory.html,What About Me,1968,a_annemurray.html
There Goes My Everything,../lyrics/annemurray/theregoesmyeverything.html,What About Me,1968,a_annemurray.html
Last Thing On My Mind,../lyrics/annemurray/lastthingonmymind.html,What About Me,1968,a_annemurray.html
All The Time,../lyrics/annemurray/allthetime.html,What About Me,1968,a_annemurray.html
,,What About Me,1968,a_annemurray.html
Bidin' My Time,../lyrics/annemurray/bidinmytime.html,This Way Is My Way,1969,a_annemurray.html
I Wonder How The Old Folks Are At Home,../lyrics/annemurray/iwonderhowtheoldfolksareathome.html,This Way Is My Way,1969,a_annemurray.html
Thirsty Boots,../lyrics/annemurray/thirstyboots.html,This Way Is My Way,1969,a_annemurray.html
Snowbird,../lyrics/annemurray/snowbird.html,This Way Is My Way,1969,a_annemurray.html
Hard As I Try,../lyrics/annemurray/hardasitry.html,This Way Is My Way,1969,a_annemurray.html
I'll Be Your Baby Tonight,../lyrics/annemurray/illbeyourbabytonight.html,This Way Is My Way,1969,a_annemurray.html
Nice To Be With You,../lyrics/annemurray/nicetobewithyou.html,This Way Is My Way,1969,a_annemurray.html
,,This Way Is My Way,1969,a_annemurray.html
O Come All Ye Faithful,../lyrics/annemurray/ocomeallyefaithful.html,Anne Murray's Christmas,1970,a_annemurray.html
White Christmas,../lyrics/annemurray/whitechristmas.html,Anne Murray's Christmas,1970,a_annemurray.html
The Christmas Song,../lyrics/annemurray/thechristmassong.html,Anne Murray's Christmas,1970,a_annemurray.html
Do You Hear What I Hear?,../lyrics/annemurray/doyouhearwhatihear.html,Anne Murray's Christmas,1970,a_annemurray.html
We Three Kings,../lyrics/annemurray/wethreekings.html,Anne Murray's Christmas,1970,a_annemurray.html
Coventry Carol,../lyrics/annemurray/coventrycarol.html,Anne Murray's Christmas,1970,a_annemurray.html
It Came Upon A Midnight Clear,../lyrics/annemurray/itcameuponamidnightclear.html,Anne Murray's Christmas,1970,a_annemurray.html
Christmas In Killarney,../lyrics/annemurray/christmasinkillarney.html,Anne Murray's Christmas,1970,a_annemurray.html
Born In Bethlehem,../lyrics/annemurray/borninbethlehem.html,Anne Murray's Christmas,1970,a_annemurray.html
No Room At The Inn,../lyrics/annemurray/noroomattheinn.html,Anne Murray's Christmas,1970,a_annemurray.html
Sweet Little Jesus Boy,../lyrics/annemurray/sweetlittlejesusboy.html,Anne Murray's Christmas,1970,a_annemurray.html
Mary's Little Boy Child,../lyrics/annemurray/maryslittleboychild.html,Anne Murray's Christmas,1970,a_annemurray.html
,,Anne Murray's Christmas,1970,a_annemurray.html
Fire And Rain,../lyrics/annemurray/fireandrain.html,"Honey, Wheat & Laughter",1970,a_annemurray.html
Break My Mind,../lyrics/annemurray/breakmymind.html,"Honey, Wheat & Laughter",1970,a_annemurray.html
Call,../lyrics/annemurray/call.html,"Honey, Wheat & Laughter",1970,a_annemurray.html
Put Your Hand In The Hand,../lyrics/annemurray/putyourhandinthehand.html,"Honey, Wheat & Laughter",1970,a_annemurray.html
Get Together,../lyrics/annemurray/gettogether.html,"Honey, Wheat & Laughter",1970,a_annemurray.html
Night Owl,../lyrics/annemurray/nightowl.html,"Honey, Wheat & Laughter",1970,a_annemurray.html
,,"Honey, Wheat & Laughter",1970,a_annemurray.html
You're Easy To Love,../lyrics/annemurray/youreeasytolove.html,,,a_annemurray.html
Medley: I Said A Little Prayer / By The Time I Get To Phoenix,../lyrics/annemurray/medleyisaidalittleprayerbythetimeigettophoenix.html,,,a_annemurray.html
United We Stand,../lyrics/annemurray/unitedwestand.html,,,a_annemurray.html
Love Story (You And Me),../lyrics/annemurray/lovestoryyouandme.html,,,a_annemurray.html
Ease Your Pain,../lyrics/annemurray/easeyourpain.html,,,a_annemurray.html
Let Me Be The One,../lyrics/annemurray/letmebetheone.html,,,a_annemurray.html
,,,,a_annemurray.html
It Takes Time,../lyrics/annemurray/ittakestime.html,"Straight, Clean And Simple",1971,a_annemurray.html
People's Park,../lyrics/annemurray/peoplespark.html,"Straight, Clean And Simple",1971,a_annemurray.html
One Day I Walk,../lyrics/annemurray/onedayiwalk.html,"Straight, Clean And Simple",1971,a_annemurray.html
Child Of Mine,../lyrics/annemurray/childofmine.html,"Straight, Clean And Simple",1971,a_annemurray.html
Wishing Smiles Made It All True,../lyrics/annemurray/wishingsmilesmadeitalltrue.html,"Straight, Clean And Simple",1971,a_annemurray.html
"Sing High, Sing Low",../lyrics/annemurray/singhighsinglow.html,"Straight, Clean And Simple",1971,a_annemurray.html
A Stranger In My Place,../lyrics/annemurray/astrangerinmyplace.html,"Straight, Clean And Simple",1971,a_annemurray.html
I'll Never Fall In Love Again,../lyrics/annemurray/illneverfallinloveagain.html,"Straight, Clean And Simple",1971,a_annemurray.html
,,"Straight, Clean And Simple",1971,a_annemurray.html
Talk It Over In The Morning,../lyrics/annemurray/talkitoverinthemorning.html,Talk It Over In The Morning,1971,a_annemurray.html
Most Of All,../lyrics/annemurray/mostofall.html,Talk It Over In The Morning,1971,a_annemurray.html
Let Me Be The One,../lyrics/annemurray/letmebetheone.html,Talk It Over In The Morning,1971,a_annemurray.html
Night Owl,../lyrics/annemurray/nightowl.html,Talk It Over In The Morning,1971,a_annemurray.html
Destiny,../lyrics/annemurray/destiny.html,Talk It Over In The Morning,1971,a_annemurray.html
I Know,../lyrics/annemurray/iknow.html,Talk It Over In The Morning,1971,a_annemurray.html
You've Got A Friend,../lyrics/annemurray/youvegotafriend.html,Talk It Over In The Morning,1971,a_annemurray.html
Cotton Jenny,../lyrics/annemurray/cottonjenny.html,Talk It Over In The Morning,1971,a_annemurray.html
,,Talk It Over In The Morning,1971,a_annemurray.html
Robbie's Song For Jesus,../lyrics/annemurray/robbiessongforjesus.html,Annie,1972,a_annemurray.html
Falling Into Rhyme,../lyrics/annemurray/fallingintorhyme.html,Annie,1972,a_annemurray.html
Drown Me,../lyrics/annemurray/drownme.html,Annie,1972,a_annemurray.html
Beautiful,../lyrics/annemurray/beautiful.html,Annie,1972,a_annemurray.html
,,Annie,1972,a_annemurray.html
Danny's Song,../lyrics/annemurray/dannyssong.html,Danny's Song,1973,a_annemurray.html
Killing Me Softly With His Song,../lyrics/annemurray/killingmesoftlywithhissong.html,Danny's Song,1973,a_annemurray.html
He Thinks I Still Care,../lyrics/annemurray/hethinksistillcare.html,Danny's Song,1973,a_annemurray.html
I'll Be Home,../lyrics/annemurray/illbehome.html,Danny's Song,1973,a_annemurray.html
What About Me,../lyrics/annemurray/whataboutme.html,Danny's Song,1973,a_annemurray.html
I Know,../lyrics/annemurray/iknow.html,Danny's Song,1973,a_annemurray.html
Ease Your Pain,../lyrics/annemurray/easeyourpain.html,Danny's Song,1973,a_annemurray.html
One Day I Walk,../lyrics/annemurray/onedayiwalk.html,Danny's Song,1973,a_annemurray.html
Put Your Hand In The Hand,../lyrics/annemurray/putyourhandinthehand.html,Danny's Song,1973,a_annemurray.html
,,Danny's Song,1973,a_annemurray.html
Dream Lover,../lyrics/annemurray/dreamlover.html,Highly Prized Possession,1974,a_annemurray.html
Day Tripper,../lyrics/annemurray/daytripper.html,Highly Prized Possession,1974,a_annemurray.html
Uproar,../lyrics/annemurray/uproar.html,Highly Prized Possession,1974,a_annemurray.html
,,Highly Prized Possession,1974,a_annemurray.html
Love Song,../lyrics/annemurray/lovesong.html,Love Song,1974,a_annemurray.html
Just One Look,../lyrics/annemurray/justonelook.html,Love Song,1974,a_annemurray.html
Another Pot O' Tea,../lyrics/annemurray/anotherpototea.html,Love Song,1974,a_annemurray.html
Watching The River Run,../lyrics/annemurray/watchingtheriverrun.html,Love Song,1974,a_annemurray.html
Son Of A Rotten Gambler,../lyrics/annemurray/sonofarottengambler.html,Love Song,1974,a_annemurray.html
You Won't See Me,../lyrics/annemurray/youwontseeme.html,Love Song,1974,a_annemurray.html
Send Little Love My Way,../lyrics/annemurray/sendlittlelovemyway.html,Love Song,1974,a_annemurray.html
,,Love Song,1974,a_annemurray.html
Sunday Sunrise,../lyrics/annemurray/sundaysunrise.html,Together,1975,a_annemurray.html
Call,../lyrics/annemurray/call.html,Together,1975,a_annemurray.html
Everything Old Is New Again,../lyrics/annemurray/everythingoldisnewagain.html,Together,1975,a_annemurray.html
,,Together,1975,a_annemurray.html
Things,../lyrics/annemurray/things.html,Keeping In Touch,1976,a_annemurray.html
Sweet Music Man,../lyrics/annemurray/sweetmusicman.html,Keeping In Touch,1976,a_annemurray.html
Sunday School To Broadway,../lyrics/annemurray/sundayschooltobroadway.html,Keeping In Touch,1976,a_annemurray.html
Lay Me Down,../lyrics/annemurray/laymedown.html,Keeping In Touch,1976,a_annemurray.html
Million More,../lyrics/annemurray/millionmore.html,Keeping In Touch,1976,a_annemurray.html
,,Keeping In Touch,1976,a_annemurray.html
Hey Daddy,../lyrics/annemurray/heydaddy.html,There's A Hippo In My Tub,1977,a_annemurray.html
Stars Are The Windows Of Heaven,../lyrics/annemurray/starsarethewindowsofheaven.html,There's A Hippo In My Tub,1977,a_annemurray.html
Animal Crackers,../lyrics/annemurray/animalcrackers.html,There's A Hippo In My Tub,1977,a_annemurray.html
"Hi Lili, Hi Lo",../lyrics/annemurray/hililihilo.html,There's A Hippo In My Tub,1977,a_annemurray.html
"Why, Oh, Why",../lyrics/annemurray/whyohwhy.html,There's A Hippo In My Tub,1977,a_annemurray.html
Teddy Bear's Picnic,../lyrics/annemurray/teddybearspicnic.html,There's A Hippo In My Tub,1977,a_annemurray.html
Inchworm,../lyrics/annemurray/inchworm.html,There's A Hippo In My Tub,1977,a_annemurray.html
You Are My Sunshine/open Up Your Heart,../lyrics/annemurray/youaremysunshineopenupyourheart.html,There's A Hippo In My Tub,1977,a_annemurray.html
Sleepy Time,../lyrics/annemurray/sleepytime.html,There's A Hippo In My Tub,1977,a_annemurray.html
Lullaby Medley,../lyrics/annemurray/lullabymedley.html,There's A Hippo In My Tub,1977,a_annemurray.html
,,There's A Hippo In My Tub,1977,a_annemurray.html
Let's Keep It That Way,../lyrics/annemurray/letskeepitthatway.html,Let's Keep It That Way,1978,a_annemurray.html
Walk Right Back,../lyrics/annemurray/walkrightback.html,Let's Keep It That Way,1978,a_annemurray.html
Just To Feel This Love From You,../lyrics/annemurray/justtofeelthislovefromyou.html,Let's Keep It That Way,1978,a_annemurray.html
We Don't Make Love Anymore,../lyrics/annemurray/wedontmakeloveanymore.html,Let's Keep It That Way,1978,a_annemurray.html
I Still Wish The Very Best For You,../lyrics/annemurray/istillwishtheverybestforyou.html,Let's Keep It That Way,1978,a_annemurray.html
You Needed Me,../lyrics/annemurray/youneededme.html,Let's Keep It That Way,1978,a_annemurray.html
You're A Part Of Me,../lyrics/annemurray/youreapartofme.html,Let's Keep It That Way,1978,a_annemurray.html
Hold Me Tight,../lyrics/annemurray/holdmetight.html,Let's Keep It That Way,1978,a_annemurray.html
Tennessee Waltz,../lyrics/annemurray/tennesseewaltz.html,Let's Keep It That Way,1978,a_annemurray.html
There's Always A Goodbye,../lyrics/annemurray/theresalwaysagoodbye.html,Let's Keep It That Way,1978,a_annemurray.html
,,Let's Keep It That Way,1978,a_annemurray.html
Shadows In The Moonlight,../lyrics/annemurray/shadowsinthemoonlight.html,New Kind Of Feeling,1979,a_annemurray.html
You've Got What It Takes,../lyrics/annemurray/youvegotwhatittakes.html,New Kind Of Feeling,1979,a_annemurray.html
I Just Fall In Love Again,../lyrics/annemurray/ijustfallinloveagain.html,New Kind Of Feeling,1979,a_annemurray.html
Take This Heart,../lyrics/annemurray/takethisheart.html,New Kind Of Feeling,1979,a_annemurray.html
Yucatan Cafe,../lyrics/annemurray/yucatancafe.html,New Kind Of Feeling,1979,a_annemurray.html
You Needed Me,../lyrics/annemurray/youneededme.html,New Kind Of Feeling,1979,a_annemurray.html
For No Reason At All,../lyrics/annemurray/fornoreasonatall.html,New Kind Of Feeling,1979,a_annemurray.html
Raining In My Heart,../lyrics/annemurray/raininginmyheart.html,New Kind Of Feeling,1979,a_annemurray.html
That's Why I Love You,../lyrics/annemurray/thatswhyiloveyou.html,New Kind Of Feeling,1979,a_annemurray.html
(He Can't Help It If ) He's Not You,../lyrics/annemurray/hecanthelpitifhesnotyou.html,New Kind Of Feeling,1979,a_annemurray.html
Heaven Is Here,../lyrics/annemurray/heavenishere.html,New Kind Of Feeling,1979,a_annemurray.html
,,New Kind Of Feeling,1979,a_annemurray.html
You've Got Me To Hold On To,../lyrics/annemurray/youvegotmetoholdonto.html,I'll Always Love You,1979,a_annemurray.html
I'll Always Love You,../lyrics/annemurray/illalwaysloveyou.html,I'll Always Love You,1979,a_annemurray.html
Stranger At My Door,../lyrics/annemurray/strangeratmydoor.html,I'll Always Love You,1979,a_annemurray.html
Good Old Song,../lyrics/annemurray/goodoldsong.html,I'll Always Love You,1979,a_annemurray.html
Why Don't You Stick Around,../lyrics/annemurray/whydontyoustickaround.html,I'll Always Love You,1979,a_annemurray.html
Broken Hearted Me,../lyrics/annemurray/brokenheartedme.html,I'll Always Love You,1979,a_annemurray.html
Daydream Believer,../lyrics/annemurray/daydreambeliever.html,I'll Always Love You,1979,a_annemurray.html
Wintery Feeling,../lyrics/annemurray/winteryfeeling.html,I'll Always Love You,1979,a_annemurray.html
,,I'll Always Love You,1979,a_annemurray.html
Lucky Me,../lyrics/annemurray/luckyme.html,Somebody's Waiting,1980,a_annemurray.html
You Set My Dreams To Music,../lyrics/annemurray/yousetmydreamstomusic.html,Somebody's Waiting,1980,a_annemurray.html
What's Forever For,../lyrics/annemurray/whatsforeverfor.html,Somebody's Waiting,1980,a_annemurray.html
Do You Thing Of Me?,../lyrics/annemurray/doyouthingofme.html,Somebody's Waiting,1980,a_annemurray.html
French Waltz,../lyrics/annemurray/frenchwaltz.html,Somebody's Waiting,1980,a_annemurray.html
Daydream Believer,../lyrics/annemurray/daydreambeliever.html,Somebody's Waiting,1980,a_annemurray.html
I'm Happy Just To Dance With You,../lyrics/annemurray/imhappyjusttodancewithyou.html,Somebody's Waiting,1980,a_annemurray.html
Moon Over Brooklyn,../lyrics/annemurray/moonoverbrooklyn.html,Somebody's Waiting,1980,a_annemurray.html
Nevertheless (I'm In Love With You),../lyrics/annemurray/neverthelessiminlovewithyou.html,Somebody's Waiting,1980,a_annemurray.html
Beginning To Feel Like Home,../lyrics/annemurray/beginningtofeellikehome.html,Somebody's Waiting,1980,a_annemurray.html
Somebody's Waiting,../lyrics/annemurray/somebodyswaiting.html,Somebody's Waiting,1980,a_annemurray.html
,,Somebody's Waiting,1980,a_annemurray.html
Winter Wonderland,../lyrics/annemurray/winterwonderland.html,Christmas Wishes,1981,a_annemurray.html
Silver Bells,../lyrics/annemurray/silverbells.html,Christmas Wishes,1981,a_annemurray.html
The Little Drummer Boy,../lyrics/annemurray/thelittledrummerboy.html,Christmas Wishes,1981,a_annemurray.html
I'll Be Home For Christmas,../lyrics/annemurray/illbehomeforchristmas.html,Christmas Wishes,1981,a_annemurray.html
Christmas Wishes,../lyrics/annemurray/christmaswishes.html,Christmas Wishes,1981,a_annemurray.html
Joy To The World,../lyrics/annemurray/joytotheworld.html,Christmas Wishes,1981,a_annemurray.html
Away In A Manger,../lyrics/annemurray/awayinamanger.html,Christmas Wishes,1981,a_annemurray.html
O Holy Night,../lyrics/annemurray/oholynight.html,Christmas Wishes,1981,a_annemurray.html
Go Tell It On The Mountain,../lyrics/annemurray/gotellitonthemountain.html,Christmas Wishes,1981,a_annemurray.html
Silent Night,../lyrics/annemurray/silentnight.html,Christmas Wishes,1981,a_annemurray.html
,,Christmas Wishes,1981,a_annemurray.html
Blessed Are The Believers,../lyrics/annemurray/blessedarethebelievers.html,Where Do You Go When You Dream,1981,a_annemurray.html
It Should Have Been Easy,../lyrics/annemurray/itshouldhavebeeneasy.html,Where Do You Go When You Dream,1981,a_annemurray.html
If A Heart Must Be Broken,../lyrics/annemurray/ifaheartmustbebroken.html,Where Do You Go When You Dream,1981,a_annemurray.html
"Bitter They Are, Harder They Fall",../lyrics/annemurray/bittertheyarehardertheyfall.html,Where Do You Go When You Dream,1981,a_annemurray.html
It's All I Can Do,../lyrics/annemurray/itsallicando.html,Where Do You Go When You Dream,1981,a_annemurray.html
We Don't Have To Hold Out,../lyrics/annemurray/wedonthavetoholdout.html,Where Do You Go When You Dream,1981,a_annemurray.html
Another Sleepless Night,../lyrics/annemurray/anothersleeplessnight.html,Where Do You Go When You Dream,1981,a_annemurray.html
Where Do You Go When You Dream,../lyrics/annemurray/wheredoyougowhenyoudream.html,Where Do You Go When You Dream,1981,a_annemurray.html
,,Where Do You Go When You Dream,1981,a_annemurray.html
Fallin' In Love (Fallin' Apart),../lyrics/annemurray/fallininlovefallinapart.html,Hottest Night Of The Year,1982,a_annemurray.html
Somebody's Always Saying Goodbye,../lyrics/annemurray/somebodysalwayssayinggoodbye.html,Hottest Night Of The Year,1982,a_annemurray.html
Hey! Baby!,../lyrics/annemurray/heybaby.html,Hottest Night Of The Year,1982,a_annemurray.html
Song For The Mira,../lyrics/annemurray/songforthemira.html,Hottest Night Of The Year,1982,a_annemurray.html
,,Hottest Night Of The Year,1982,a_annemurray.html
That's Not The Way (It's S'posed To Be),../lyrics/annemurray/thatsnotthewayitssposedtobe.html,A Little Good News,1983,a_annemurray.html
I'm Not Afraid Anymore,../lyrics/annemurray/imnotafraidanymore.html,A Little Good News,1983,a_annemurray.html
A Little Good News,../lyrics/annemurray/alittlegoodnews.html,A Little Good News,1983,a_annemurray.html
Come On Love,../lyrics/annemurray/comeonlove.html,A Little Good News,1983,a_annemurray.html
Just Another Woman In Love,../lyrics/annemurray/justanotherwomaninlove.html,A Little Good News,1983,a_annemurray.html
,,A Little Good News,1983,a_annemurray.html
Time Don't Run Out On Me,../lyrics/annemurray/timedontrunoutonme.html,Heart Over Mind,1985,a_annemurray.html
I Don't Think I'm Ready For You,../lyrics/annemurray/idontthinkimreadyforyou.html,Heart Over Mind,1985,a_annemurray.html
You Havn't Heard The Last Of Me,../lyrics/annemurray/youhavntheardthelastofme.html,Heart Over Mind,1985,a_annemurray.html
Nobody Loves Me Like You Do,../lyrics/annemurray/nobodylovesmelikeyoudo.html,Heart Over Mind,1985,a_annemurray.html
Love You Out Of Your Mind,../lyrics/annemurray/loveyououtofyourmind.html,Heart Over Mind,1985,a_annemurray.html
Take Good Care Of Your Heart,../lyrics/annemurray/takegoodcareofyourheart.html,Heart Over Mind,1985,a_annemurray.html
,,Heart Over Mind,1985,a_annemurray.html
Now And Forever (You And Me),../lyrics/annemurray/nowandforeveryouandme.html,Something To Talk About,1986,a_annemurray.html
Who's Leaving Who,../lyrics/annemurray/whosleavingwho.html,Something To Talk About,1986,a_annemurray.html
My Life's A Dance,../lyrics/annemurray/mylifesadance.html,Something To Talk About,1986,a_annemurray.html
When You're Gone,../lyrics/annemurray/whenyouregone.html,Something To Talk About,1986,a_annemurray.html
,,Something To Talk About,1986,a_annemurray.html
Flying On Your Own,../lyrics/annemurray/flyingonyourown.html,As I Am,1988,a_annemurray.html
As I Am,../lyrics/annemurray/asiam.html,As I Am,1988,a_annemurray.html
I'm Losing Your Love,../lyrics/annemurray/imlosingyourlove.html,As I Am,1988,a_annemurray.html
Take It From My Heart,../lyrics/annemurray/takeitfrommyheart.html,As I Am,1988,a_annemurray.html
,,As I Am,1988,a_annemurray.html
Are You Still In Love With Me,../lyrics/annemurray/areyoustillinlovewithme.html,Harmony,1989,a_annemurray.html
Anyone Can Do The Heartbreak,../lyrics/annemurray/anyonecandotheheartbreak.html,Harmony,1989,a_annemurray.html
Perfect Strangers,../lyrics/annemurray/perfectstrangers.html,Harmony,1989,a_annemurray.html
,,Harmony,1989,a_annemurray.html
Hold Me (Just A Little Longer Tonight),../lyrics/annemurray/holdmejustalittlelongertonight.html,You Will,1990,a_annemurray.html
New Way Out,../lyrics/annemurray/newwayout.html,You Will,1990,a_annemurray.html
Bluebird,../lyrics/annemurray/bluebird.html,You Will,1990,a_annemurray.html
Wrong End Of The Rainbow,../lyrics/annemurray/wrongendoftherainbow.html,You Will,1990,a_annemurray.html
Feed This Fire,../lyrics/annemurray/feedthisfire.html,You Will,1990,a_annemurray.html
A Little Short Of Love,../lyrics/annemurray/alittleshortoflove.html,You Will,1990,a_annemurray.html
"A New Moon, An Old Flame And You",../lyrics/annemurray/anewmoonanoldflameandyou.html,You Will,1990,a_annemurray.html
,,You Will,1990,a_annemurray.html
I Can See Arkansas,../lyrics/annemurray/icanseearkansas.html,Yes I Do,1991,a_annemurray.html
Even The Nights Are Better,../lyrics/annemurray/eventhenightsarebetter.html,Yes I Do,1991,a_annemurray.html
Oh Yes I Do,../lyrics/annemurray/ohyesido.html,Yes I Do,1991,a_annemurray.html
Some Days It Rains All Night Long,../lyrics/annemurray/somedaysitrainsallnightlong.html,Yes I Do,1991,a_annemurray.html
Roots And Wings,../lyrics/annemurray/rootsandwings.html,Yes I Do,1991,a_annemurray.html
Wrong End Of The Rainbow,../lyrics/annemurray/wrongendoftherainbow.html,Yes I Do,1991,a_annemurray.html
,,Yes I Do,1991,a_annemurray.html
Old Cape Cod,../lyrics/annemurray/oldcapecod.html,Croonin',1993,a_annemurray.html
The Wayward Wind,../lyrics/annemurray/thewaywardwind.html,Croonin',1993,a_annemurray.html
Secret Love,../lyrics/annemurray/secretlove.html,Croonin',1993,a_annemurray.html
Fever,../lyrics/annemurray/fever.html,Croonin',1993,a_annemurray.html
When I Fall In Love,../lyrics/annemurray/whenifallinlove.html,Croonin',1993,a_annemurray.html
Allegheny Moon,../lyrics/annemurray/alleghenymoon.html,Croonin',1993,a_annemurray.html
You Belong To Me,../lyrics/annemurray/youbelongtome.html,Croonin',1993,a_annemurray.html
Born To Be With You,../lyrics/annemurray/borntobewithyou.html,Croonin',1993,a_annemurray.html
True Love,../lyrics/annemurray/truelove.html,Croonin',1993,a_annemurray.html
Teach Me Tonight,../lyrics/annemurray/teachmetonight.html,Croonin',1993,a_annemurray.html
Cry Me A River,../lyrics/annemurray/crymeariver.html,Croonin',1993,a_annemurray.html
Make Love To Me,../lyrics/annemurray/makelovetome.html,Croonin',1993,a_annemurray.html
Hey There,../lyrics/annemurray/heythere.html,Croonin',1993,a_annemurray.html
It Only Hurts For A Little While,../lyrics/annemurray/itonlyhurtsforalittlewhile.html,Croonin',1993,a_annemurray.html
I'm Confessin' That I Love You / I'm A Fool To Care,../lyrics/annemurray/imconfessinthatiloveyouimafooltocare.html,Croonin',1993,a_annemurray.html
Wanted,../lyrics/annemurray/wanted.html,Croonin',1993,a_annemurray.html
I Really Don't Want To Know,../lyrics/annemurray/ireallydontwanttoknow.html,Croonin',1993,a_annemurray.html
Moments To Remember,../lyrics/annemurray/momentstoremember.html,Croonin',1993,a_annemurray.html
,,Croonin',1993,a_annemurray.html
That's The Way It Goes,../lyrics/annemurray/thatsthewayitgoes.html,Anne Murray,1996,a_annemurray.html
That's What My Love Is For,../lyrics/annemurray/thatswhatmyloveisfor.html,Anne Murray,1996,a_annemurray.html
What Would It Take,../lyrics/annemurray/whatwouldittake.html,Anne Murray,1996,a_annemurray.html
Me Too,../lyrics/annemurray/metoo.html,Anne Murray,1996,a_annemurray.html
"Trust Me Baby, This Is Love",../lyrics/annemurray/trustmebabythisislove.html,Anne Murray,1996,a_annemurray.html
Other Side,../lyrics/annemurray/otherside.html,Anne Murray,1996,a_annemurray.html
Shame On Me,../lyrics/annemurray/shameonme.html,Anne Murray,1996,a_annemurray.html
Good Again,../lyrics/annemurray/goodagain.html,Anne Murray,1996,a_annemurray.html
,,Anne Murray,1996,a_annemurray.html
"Lord, I Hope This Day Is Good",../lyrics/annemurray/lordihopethisdayisgood.html,What A Wonderful World,1999,a_annemurray.html
Amazing Grace,../lyrics/annemurray/amazinggrace.html,What A Wonderful World,1999,a_annemurray.html
Lean On Me,../lyrics/annemurray/leanonme.html,What A Wonderful World,1999,a_annemurray.html
Just A Closer Walk With Thee / Take My Hand Lord Jes,../lyrics/annemurray/justacloserwalkwiththeetakemyhandlordjes.html,What A Wonderful World,1999,a_annemurray.html
Let It Be,../lyrics/annemurray/letitbe.html,What A Wonderful World,1999,a_annemurray.html
Softly And Tenderly,../lyrics/annemurray/softlyandtenderly.html,What A Wonderful World,1999,a_annemurray.html
Let There Be Love - Dawn Langstroth,../lyrics/annemurray/lettherebelovedawnlangstroth.html,What A Wonderful World,1999,a_annemurray.html
I Believe In You,../lyrics/annemurray/ibelieveinyou.html,What A Wonderful World,1999,a_annemurray.html
It Is No Secret,../lyrics/annemurray/itisnosecret.html,What A Wonderful World,1999,a_annemurray.html
What A Wonderful World,../lyrics/annemurray/whatawonderfulworld.html,What A Wonderful World,1999,a_annemurray.html
Peace In The Valley,../lyrics/annemurray/peaceinthevalley.html,What A Wonderful World,1999,a_annemurray.html
Other Side,../lyrics/annemurray/otherside.html,What A Wonderful World,1999,a_annemurray.html
Old Rugged Cross,../lyrics/annemurray/oldruggedcross.html,What A Wonderful World,1999,a_annemurray.html
I Can See Clearly Now,../lyrics/annemurray/icanseeclearlynow.html,What A Wonderful World,1999,a_annemurray.html
In The Garden,../lyrics/annemurray/inthegarden.html,What A Wonderful World,1999,a_annemurray.html
You've Got A Friend,../lyrics/annemurray/youvegotafriend.html,What A Wonderful World,1999,a_annemurray.html
Whispering Hope,../lyrics/annemurray/whisperinghope.html,What A Wonderful World,1999,a_annemurray.html
Put A Little Love In Your Heart,../lyrics/annemurray/putalittleloveinyourheart.html,What A Wonderful World,1999,a_annemurray.html
How Great Thou Art,../lyrics/annemurray/howgreatthouart.html,What A Wonderful World,1999,a_annemurray.html
Song Of Bernadette,../lyrics/annemurray/songofbernadette.html,What A Wonderful World,1999,a_annemurray.html
Elijah,../lyrics/annemurray/elijah.html,What A Wonderful World,1999,a_annemurray.html
