song,link,album,year,artist
Bridge Over Troubled Water,../lyrics/annemurray/bridgeovertroubledwater.html,What A Wonderful World,1999,a_annemurray.html
If You See My Savior,../lyrics/annemurray/ifyouseemysavior.html,What A Wonderful World,1999,a_annemurray.html
Jacob's Ladder,../lyrics/annemurray/jacobsladder.html,What A Wonderful World,1999,a_annemurray.html
Nearer My God To Thee,../lyrics/annemurray/nearermygodtothee.html,What A Wonderful World,1999,a_annemurray.html
Lord's Prayer,../lyrics/annemurray/lordsprayer.html,What A Wonderful World,1999,a_annemurray.html
,,What A Wonderful World,1999,a_annemurray.html
Help Me Make It Through The Night,../lyrics/annemurray/helpmemakeitthroughthenight.html,Country Croonin',2002,a_annemurray.html
Someday (You'll Want Me To Want You),../lyrics/annemurray/somedayyoullwantmetowantyou.html,Country Croonin',2002,a_annemurray.html
The End Of The World,../lyrics/annemurray/theendoftheworld.html,Country Croonin',2002,a_annemurray.html
Oh Lonesome Me,../lyrics/annemurray/ohlonesomeme.html,Country Croonin',2002,a_annemurray.html
I Can't Stop Loving You,../lyrics/annemurray/icantstoplovingyou.html,Country Croonin',2002,a_annemurray.html
Me And Bobby Mcgee,../lyrics/annemurray/meandbobbymcgee.html,Country Croonin',2002,a_annemurray.html
Can't Help Falling In Love,../lyrics/annemurray/canthelpfallinginlove.html,Country Croonin',2002,a_annemurray.html
Let It Be Me,../lyrics/annemurray/letitbeme.html,Country Croonin',2002,a_annemurray.html
Singing The Blues,../lyrics/annemurray/singingtheblues.html,Country Croonin',2002,a_annemurray.html
I Really Don't Want To Know,../lyrics/annemurray/ireallydontwanttoknow.html,Country Croonin',2002,a_annemurray.html
(Now And Then There's) A Fool Such As I,../lyrics/annemurray/nowandthentheresafoolsuchasi.html,Country Croonin',2002,a_annemurray.html
Always On My Mind,../lyrics/annemurray/alwaysonmymind.html,Country Croonin',2002,a_annemurray.html
('Til) I Kissed You,../lyrics/annemurray/tilikissedyou.html,Country Croonin',2002,a_annemurray.html
Loving Arms,../lyrics/annemurray/lovingarms.html,Country Croonin',2002,a_annemurray.html
Are You Lonesome Tonight?,../lyrics/annemurray/areyoulonesometonight.html,Country Croonin',2002,a_annemurray.html
Make The World Go Away,../lyrics/annemurray/maketheworldgoaway.html,Country Croonin',2002,a_annemurray.html
Anytime,../lyrics/annemurray/anytime.html,Country Croonin',2002,a_annemurray.html
You Don't Know Me,../lyrics/annemurray/youdontknowme.html,Country Croonin',2002,a_annemurray.html
Bye Bye Love,../lyrics/annemurray/byebyelove.html,Country Croonin',2002,a_annemurray.html
Vaya Con Dios (May God Be With You),../lyrics/annemurray/vayacondiosmaygodbewithyou.html,Country Croonin',2002,a_annemurray.html
Take These Chains From My Heart,../lyrics/annemurray/takethesechainsfrommyheart.html,Country Croonin',2002,a_annemurray.html
For The Good Times,../lyrics/annemurray/forthegoodtimes.html,Country Croonin',2002,a_annemurray.html
Sea Of Heartbreak,../lyrics/annemurray/seaofheartbreak.html,Country Croonin',2002,a_annemurray.html
She'll Have To Go,../lyrics/annemurray/shellhavetogo.html,Country Croonin',2002,a_annemurray.html
I'm Confessin' That I Love You / I'm A Fool To Care,../lyrics/annemurray/imconfessinthatiloveyouimafooltocare.html,Country Croonin',2002,a_annemurray.html
Blue Blue Day,../lyrics/annemurray/blueblueday.html,Country Croonin',2002,a_annemurray.html
That's The Way Love Goes,../lyrics/annemurray/thatsthewaylovegoes.html,Country Croonin',2002,a_annemurray.html
I Fall To Pieces,../lyrics/annemurray/ifalltopieces.html,Country Croonin',2002,a_annemurray.html
All I Have To Do Is Dream,../lyrics/annemurray/allihavetodoisdream.html,Country Croonin',2002,a_annemurray.html
Tennessee Waltz,../lyrics/annemurray/tennesseewaltz.html,Country Croonin',2002,a_annemurray.html
,,Country Croonin',2002,a_annemurray.html
All Of Me,../lyrics/annemurray/allofme.html,I'll Be Seeing You,2004,a_annemurray.html
As Time Goes By,../lyrics/annemurray/astimegoesby.html,I'll Be Seeing You,2004,a_annemurray.html
Dream A Little Dream Of Me,../lyrics/annemurray/dreamalittledreamofme.html,I'll Be Seeing You,2004,a_annemurray.html
I Wonder Who's Kissing Him Now,../lyrics/annemurray/iwonderwhoskissinghimnow.html,I'll Be Seeing You,2004,a_annemurray.html
I'm Gonna Sit Right Down And Write Myself A Letter,../lyrics/annemurray/imgonnasitrightdownandwritemyselfaletter.html,I'll Be Seeing You,2004,a_annemurray.html
Over The Rainbow,../lyrics/annemurray/overtherainbow.html,I'll Be Seeing You,2004,a_annemurray.html
Twilight Time,../lyrics/annemurray/twilighttime.html,I'll Be Seeing You,2004,a_annemurray.html
My Buddy,../lyrics/annemurray/mybuddy.html,I'll Be Seeing You,2004,a_annemurray.html
After You've Gone,../lyrics/annemurray/afteryouvegone.html,I'll Be Seeing You,2004,a_annemurray.html
What'll I Do,../lyrics/annemurray/whatllido.html,I'll Be Seeing You,2004,a_annemurray.html
Don't Get Around Much Anymore,../lyrics/annemurray/dontgetaroundmuchanymore.html,I'll Be Seeing You,2004,a_annemurray.html
Smile,../lyrics/annemurray/smile.html,I'll Be Seeing You,2004,a_annemurray.html
You Made Me Love You,../lyrics/annemurray/youmademeloveyou.html,I'll Be Seeing You,2004,a_annemurray.html
I'll Be Seeing You,../lyrics/annemurray/illbeseeingyou.html,I'll Be Seeing You,2004,a_annemurray.html
We'll Meet Again,../lyrics/annemurray/wellmeetagain.html,I'll Be Seeing You,2004,a_annemurray.html
A Love Song,../lyrics/annemurray/alovesong.html,,,a_annemurray.html
Canadian Sunset,../lyrics/annemurray/canadiansunset.html,,,a_annemurray.html
Could I Have This Dance,../lyrics/annemurray/couldihavethisdance.html,,,a_annemurray.html
For Baby,../lyrics/annemurray/forbaby.html,,,a_annemurray.html
I'd Fall In Love Tonight,../lyrics/annemurray/idfallinlovetonight.html,,,a_annemurray.html
If I Ever Fall In Love Again,../lyrics/annemurray/ifieverfallinloveagain.html,,,a_annemurray.html
Insensitive,../lyrics/annemurray/insensitive.html,,,a_annemurray.html
Little Good News,../lyrics/annemurray/littlegoodnews.html,,,a_annemurray.html
Over You,../lyrics/annemurray/overyou.html,,,a_annemurray.html
This Season Will Never Grow Old,../lyrics/annemurray/thisseasonwillnevergrowold.html,,,a_annemurray.html
When I Fall,../lyrics/annemurray/whenifall.html,,,a_annemurray.html
