song,link,album,year,artist
Too Cold At Home,../lyrics/markchesnutt/toocoldathome.html,Too Cold At Home,1990,"CHESNUTT, MARK"
Brother Jukebox,../lyrics/markchesnutt/brotherjukebox.html,Too Cold At Home,1990,"CHESNUTT, MARK"
Blame It On Texas,../lyrics/markchesnutt/blameitontexas.html,Too Cold At Home,1990,"CHESNUTT, MARK"
Your Love Is A Miracle,../lyrics/markchesnutt/yourloveisamiracle.html,Too Cold At Home,1990,"CHESNUTT, MARK"
Broken Promise Land,../lyrics/markchesnutt/brokenpromiseland.html,Too Cold At Home,1990,"CHESNUTT, MARK"
Too Good A Memory,../lyrics/markchesnutt/toogoodamemory.html,Too Cold At Home,1990,"CHESNUTT, MARK"
Friends In Low Places,../lyrics/markchesnutt/friendsinlowplaces.html,Too Cold At Home,1990,"CHESNUTT, MARK"
Lucky Man,../lyrics/markchesnutt/luckyman.html,Too Cold At Home,1990,"CHESNUTT, MARK"
Hey You There In The Mirror,../lyrics/markchesnutt/heyyouthereinthemirror.html,Too Cold At Home,1990,"CHESNUTT, MARK"
Danger At My Door,../lyrics/markchesnutt/dangeratmydoor.html,Too Cold At Home,1990,"CHESNUTT, MARK"
,,Too Cold At Home,1990,"CHESNUTT, MARK"
Ol' Country,../lyrics/markchesnutt/olcountry.html,Longnecks & Short Stories,1992,"CHESNUTT, MARK"
Old Flames Have New Names,../lyrics/markchesnutt/oldflameshavenewnames.html,Longnecks & Short Stories,1992,"CHESNUTT, MARK"
I'll Think Of Something,../lyrics/markchesnutt/illthinkofsomething.html,Longnecks & Short Stories,1992,"CHESNUTT, MARK"
It's Not Over (If I'm Not Over You),../lyrics/markchesnutt/itsnotoverifimnotoveryou.html,Longnecks & Short Stories,1992,"CHESNUTT, MARK"
"Uptown, Downtown (Misery's All The Same)",../lyrics/markchesnutt/uptowndowntownmiserysallthesame.html,Longnecks & Short Stories,1992,"CHESNUTT, MARK"
Bubba Shot The Jukebox,../lyrics/markchesnutt/bubbashotthejukebox.html,Longnecks & Short Stories,1992,"CHESNUTT, MARK"
Postpone The Pain,../lyrics/markchesnutt/postponethepain.html,Longnecks & Short Stories,1992,"CHESNUTT, MARK"
Talking To Hank,../lyrics/markchesnutt/talkingtohank.html,Longnecks & Short Stories,1992,"CHESNUTT, MARK"
I'm Not Getting Any Better At Goodbyes,../lyrics/markchesnutt/imnotgettinganybetteratgoodbyes.html,Longnecks & Short Stories,1992,"CHESNUTT, MARK"
Who Will The Next Fool Be?,../lyrics/markchesnutt/whowillthenextfoolbe.html,Longnecks & Short Stories,1992,"CHESNUTT, MARK"
,,Longnecks & Short Stories,1992,"CHESNUTT, MARK"
It Sure Is Monday,../lyrics/markchesnutt/itsureismonday.html,Almost Goodbye,1993,"CHESNUTT, MARK"
Woman (Sensuous Woman),../lyrics/markchesnutt/womansensuouswoman.html,Almost Goodbye,1993,"CHESNUTT, MARK"
Almost Goodbye,../lyrics/markchesnutt/almostgoodbye.html,Almost Goodbye,1993,"CHESNUTT, MARK"
I Just Wanted You To Know,../lyrics/markchesnutt/ijustwantedyoutoknow.html,Almost Goodbye,1993,"CHESNUTT, MARK"
April's Fool,../lyrics/markchesnutt/aprilsfool.html,Almost Goodbye,1993,"CHESNUTT, MARK"
Texas Is Bigger Than It Used To Be,../lyrics/markchesnutt/texasisbiggerthanitusedtobe.html,Almost Goodbye,1993,"CHESNUTT, MARK"
My Heart's Too Broke (To Pay Attention),../lyrics/markchesnutt/myheartstoobroketopayattention.html,Almost Goodbye,1993,"CHESNUTT, MARK"
Vickie Vance Gotta Dance,../lyrics/markchesnutt/vickievancegottadance.html,Almost Goodbye,1993,"CHESNUTT, MARK"
Till A Better Memory Comes Along,../lyrics/markchesnutt/tillabettermemorycomesalong.html,Almost Goodbye,1993,"CHESNUTT, MARK"
The Will,../lyrics/markchesnutt/thewill.html,Almost Goodbye,1993,"CHESNUTT, MARK"
,,Almost Goodbye,1993,"CHESNUTT, MARK"
What A Way To Live,../lyrics/markchesnutt/whatawaytolive.html,What A Way To Live,1994,"CHESNUTT, MARK"
Live A Little,../lyrics/markchesnutt/livealittle.html,What A Way To Live,1994,"CHESNUTT, MARK"
She Dreams,../lyrics/markchesnutt/shedreams.html,What A Way To Live,1994,"CHESNUTT, MARK"
Goin' Through The Big D,../lyrics/markchesnutt/gointhroughthebigd.html,What A Way To Live,1994,"CHESNUTT, MARK"
Down In Tennessee,../lyrics/markchesnutt/downintennessee.html,What A Way To Live,1994,"CHESNUTT, MARK"
Gonna Get A Life,../lyrics/markchesnutt/gonnagetalife.html,What A Way To Live,1994,"CHESNUTT, MARK"
It's Almost Like You're Here,../lyrics/markchesnutt/itsalmostlikeyourehere.html,What A Way To Live,1994,"CHESNUTT, MARK"
Rainy Day Woman,../lyrics/markchesnutt/rainydaywoman.html,What A Way To Live,1994,"CHESNUTT, MARK"
This Side Of The Door,../lyrics/markchesnutt/thissideofthedoor.html,What A Way To Live,1994,"CHESNUTT, MARK"
Half Of Everything (And All Of My Heart),../lyrics/markchesnutt/halfofeverythingandallofmyheart.html,What A Way To Live,1994,"CHESNUTT, MARK"
,,What A Way To Live,1994,"CHESNUTT, MARK"
As The Honky Tonk Turns,../lyrics/markchesnutt/asthehonkytonkturns.html,Wings,1995,"CHESNUTT, MARK"
The King Of Broken Hearts,../lyrics/markchesnutt/thekingofbrokenhearts.html,Wings,1995,"CHESNUTT, MARK"
Trouble,../lyrics/markchesnutt/trouble.html,Wings,1995,"CHESNUTT, MARK"
(I Think) I've Finally Broken Mine,../lyrics/markchesnutt/ithinkivefinallybrokenmine.html,Wings,1995,"CHESNUTT, MARK"
"Wrong Place, Wrong Time",../lyrics/markchesnutt/wrongplacewrongtime.html,Wings,1995,"CHESNUTT, MARK"
I May Be A Fool,../lyrics/markchesnutt/imaybeafool.html,Wings,1995,"CHESNUTT, MARK"
It Wouldn't Hurt To Have Wings,../lyrics/markchesnutt/itwouldnthurttohavewings.html,Wings,1995,"CHESNUTT, MARK"
Pride's Not Hard To Swallow,../lyrics/markchesnutt/pridesnothardtoswallow.html,Wings,1995,"CHESNUTT, MARK"
Settlin' For What They Get,../lyrics/markchesnutt/settlinforwhattheyget.html,Wings,1995,"CHESNUTT, MARK"
Strangers,../lyrics/markchesnutt/strangers.html,Wings,1995,"CHESNUTT, MARK"
,,Wings,1995,"CHESNUTT, MARK"
Goodbye Heartache,../lyrics/markchesnutt/goodbyeheartache.html,Thank God For Believers,1997,"CHESNUTT, MARK"
Thank God For Believers,../lyrics/markchesnutt/thankgodforbelievers.html,Thank God For Believers,1997,"CHESNUTT, MARK"
Wherever You Are,../lyrics/markchesnutt/whereveryouare.html,Thank God For Believers,1997,"CHESNUTT, MARK"
I Might Even Quit Lovin' You,../lyrics/markchesnutt/imightevenquitlovinyou.html,Thank God For Believers,1997,"CHESNUTT, MARK"
Numbers On The Jukebox,../lyrics/markchesnutt/numbersonthejukebox.html,Thank God For Believers,1997,"CHESNUTT, MARK"
That Side Of You,../lyrics/markchesnutt/thatsideofyou.html,Thank God For Believers,1997,"CHESNUTT, MARK"
Useless,../lyrics/markchesnutt/useless.html,Thank God For Believers,1997,"CHESNUTT, MARK"
Hello Honky Tonk,../lyrics/markchesnutt/hellohonkytonk.html,Thank God For Believers,1997,"CHESNUTT, MARK"
Any Ole Reason,../lyrics/markchesnutt/anyolereason.html,Thank God For Believers,1997,"CHESNUTT, MARK"
It's Not Over (If I'm Not Over You),../lyrics/markchesnutt/itsnotoverifimnotoveryou.html,Thank God For Believers,1997,"CHESNUTT, MARK"
,,Thank God For Believers,1997,"CHESNUTT, MARK"
I Don't Want To Miss A Thing,../lyrics/markchesnutt/idontwanttomissathing.html,I Don't Want To Miss A Thing,1999,"CHESNUTT, MARK"
This Heartache Never Sleeps,../lyrics/markchesnutt/thisheartacheneversleeps.html,I Don't Want To Miss A Thing,1999,"CHESNUTT, MARK"
My Way Back Home,../lyrics/markchesnutt/mywaybackhome.html,I Don't Want To Miss A Thing,1999,"CHESNUTT, MARK"
I'll Get You Back,../lyrics/markchesnutt/illgetyouback.html,I Don't Want To Miss A Thing,1999,"CHESNUTT, MARK"
That's The Way You Make An Ex,../lyrics/markchesnutt/thatsthewayyoumakeanex.html,I Don't Want To Miss A Thing,1999,"CHESNUTT, MARK"
Tonight I'll Let My Memory Take Me Home,../lyrics/markchesnutt/tonightillletmymemorytakemehome.html,I Don't Want To Miss A Thing,1999,"CHESNUTT, MARK"
Jolie,../lyrics/markchesnutt/jolie.html,I Don't Want To Miss A Thing,1999,"CHESNUTT, MARK"
What Was You Thinking,../lyrics/markchesnutt/whatwasyouthinking.html,I Don't Want To Miss A Thing,1999,"CHESNUTT, MARK"
I'm Gone,../lyrics/markchesnutt/imgone.html,I Don't Want To Miss A Thing,1999,"CHESNUTT, MARK"
Let's Talk About Our Love,../lyrics/markchesnutt/letstalkaboutourlove.html,I Don't Want To Miss A Thing,1999,"CHESNUTT, MARK"
,,I Don't Want To Miss A Thing,1999,"CHESNUTT, MARK"
Fallin' Never Felt So Good,../lyrics/markchesnutt/fallinneverfeltsogood.html,Lost In The Feeling,2000,"CHESNUTT, MARK"
Confessin' My Love,../lyrics/markchesnutt/confessinmylove.html,Lost In The Feeling,2000,"CHESNUTT, MARK"
Halfway Back To Birmingham,../lyrics/markchesnutt/halfwaybacktobirmingham.html,Lost In The Feeling,2000,"CHESNUTT, MARK"
Try Being Me,../lyrics/markchesnutt/trybeingme.html,Lost In The Feeling,2000,"CHESNUTT, MARK"
Go Away,../lyrics/markchesnutt/goaway.html,Lost In The Feeling,2000,"CHESNUTT, MARK"
It Pays Big Money,../lyrics/markchesnutt/itpaysbigmoney.html,Lost In The Feeling,2000,"CHESNUTT, MARK"
Love In The Hot Afternoon,../lyrics/markchesnutt/loveinthehotafternoon.html,Lost In The Feeling,2000,"CHESNUTT, MARK"
Angelina,../lyrics/markchesnutt/angelina.html,Lost In The Feeling,2000,"CHESNUTT, MARK"
Lost In The Feeling,../lyrics/markchesnutt/lostinthefeeling.html,Lost In The Feeling,2000,"CHESNUTT, MARK"
Somewhere Out There Tonight,../lyrics/markchesnutt/somewhereouttheretonight.html,Lost In The Feeling,2000,"CHESNUTT, MARK"
,,Lost In The Feeling,2000,"CHESNUTT, MARK"
Don't Know Why I Do It,../lyrics/markchesnutt/dontknowwhyidoit.html,Mark Chesnutt,2002,"CHESNUTT, MARK"
She Was,../lyrics/markchesnutt/shewas.html,Mark Chesnutt,2002,"CHESNUTT, MARK"
Sacred As A Sunday,../lyrics/markchesnutt/sacredasasunday.html,Mark Chesnutt,2002,"CHESNUTT, MARK"
I'm In Love With A Married Woman,../lyrics/markchesnutt/iminlovewithamarriedwoman.html,Mark Chesnutt,2002,"CHESNUTT, MARK"
Population Minus One,../lyrics/markchesnutt/populationminusone.html,Mark Chesnutt,2002,"CHESNUTT, MARK"
You'd Be Wrong,../lyrics/markchesnutt/youdbewrong.html,Mark Chesnutt,2002,"CHESNUTT, MARK"
I Want My Baby Back,../lyrics/markchesnutt/iwantmybabyback.html,Mark Chesnutt,2002,"CHESNUTT, MARK"
Just Right For You,../lyrics/markchesnutt/justrightforyou.html,Mark Chesnutt,2002,"CHESNUTT, MARK"
My Dreams,../lyrics/markchesnutt/mydreams.html,Mark Chesnutt,2002,"CHESNUTT, MARK"
I Drew Me,../lyrics/markchesnutt/idrewme.html,Mark Chesnutt,2002,"CHESNUTT, MARK"
Good Night To Be Lonely,../lyrics/markchesnutt/goodnighttobelonely.html,Mark Chesnutt,2002,"CHESNUTT, MARK"
,,Mark Chesnutt,2002,"CHESNUTT, MARK"
Somebody Save The Honky Tonks,../lyrics/markchesnutt/somebodysavethehonkytonks.html,Savin' The Honky Tonk,2004,"CHESNUTT, MARK"
I'm A Saint,../lyrics/markchesnutt/imasaint.html,Savin' The Honky Tonk,2004,"CHESNUTT, MARK"
The Lord Loves The Drinkin' Man,../lyrics/markchesnutt/thelordlovesthedrinkinman.html,Savin' The Honky Tonk,2004,"CHESNUTT, MARK"
Would These Arms Be In Your Way,../lyrics/markchesnutt/wouldthesearmsbeinyourway.html,Savin' The Honky Tonk,2004,"CHESNUTT, MARK"
You Can't Do Me This Way,../lyrics/markchesnutt/youcantdomethisway.html,Savin' The Honky Tonk,2004,"CHESNUTT, MARK"
A Hard Secret To Keep,../lyrics/markchesnutt/ahardsecrettokeep.html,Savin' The Honky Tonk,2004,"CHESNUTT, MARK"
What Are We Doing In Love,../lyrics/markchesnutt/whatarewedoinginlove.html,Savin' The Honky Tonk,2004,"CHESNUTT, MARK"
Don't Ruin It For The Rest Of Us,../lyrics/markchesnutt/dontruinitfortherestofus.html,Savin' The Honky Tonk,2004,"CHESNUTT, MARK"
Mama's House,../lyrics/markchesnutt/mamashouse.html,Savin' The Honky Tonk,2004,"CHESNUTT, MARK"
Since You Ain't Home,../lyrics/markchesnutt/sinceyouainthome.html,Savin' The Honky Tonk,2004,"CHESNUTT, MARK"
Think Like A Woman,../lyrics/markchesnutt/thinklikeawoman.html,Savin' The Honky Tonk,2004,"CHESNUTT, MARK"
Then We Can All Go Home,../lyrics/markchesnutt/thenwecanallgohome.html,Savin' The Honky Tonk,2004,"CHESNUTT, MARK"
Beer Bait And Ammo,../lyrics/markchesnutt/beerbaitandammo.html,Savin' The Honky Tonk,2004,"CHESNUTT, MARK"
My Best Drinkin',../lyrics/markchesnutt/mybestdrinkin.html,Savin' The Honky Tonk,2004,"CHESNUTT, MARK"
Honky Tonk Heroes,../lyrics/markchesnutt/honkytonkheroes.html,Savin' The Honky Tonk,2004,"CHESNUTT, MARK"
,,Savin' The Honky Tonk,2004,"CHESNUTT, MARK"
Heard It In A Love Song,../lyrics/markchesnutt/hearditinalovesong.html,Heard It In A Love Song,2006,"CHESNUTT, MARK"
Dreaming My Dreams With You,../lyrics/markchesnutt/dreamingmydreamswithyou.html,Heard It In A Love Song,2006,"CHESNUTT, MARK"
That Good That Bad,../lyrics/markchesnutt/thatgoodthatbad.html,Heard It In A Love Song,2006,"CHESNUTT, MARK"
A Hard Secret To Keep,../lyrics/markchesnutt/ahardsecrettokeep.html,Heard It In A Love Song,2006,"CHESNUTT, MARK"
A Day In The Life Of A Fool,../lyrics/markchesnutt/adayinthelifeofafool.html,Heard It In A Love Song,2006,"CHESNUTT, MARK"
You Can't Find Many Kissers,../lyrics/markchesnutt/youcantfindmanykissers.html,Heard It In A Love Song,2006,"CHESNUTT, MARK"
Apartment #9,../lyrics/markchesnutt/apartment9.html,Heard It In A Love Song,2006,"CHESNUTT, MARK"
A Shoulder To Cry On,../lyrics/markchesnutt/ashouldertocryon.html,Heard It In A Love Song,2006,"CHESNUTT, MARK"
Goodbye Comes Hard For Me,../lyrics/markchesnutt/goodbyecomeshardforme.html,Heard It In A Love Song,2006,"CHESNUTT, MARK"
Lost Highway,../lyrics/markchesnutt/losthighway.html,Heard It In A Love Song,2006,"CHESNUTT, MARK"
,,Heard It In A Love Song,2006,"CHESNUTT, MARK"
Things To Do In Wichita,../lyrics/markchesnutt/thingstodoinwichita.html,Rollin' With The Flow,2008,"CHESNUTT, MARK"
When You Love Her Like Crazy,../lyrics/markchesnutt/whenyouloveherlikecrazy.html,Rollin' With The Flow,2008,"CHESNUTT, MARK"
Rollin' With The Flow,../lyrics/markchesnutt/rollinwiththeflow.html,Rollin' With The Flow,2008,"CHESNUTT, MARK"
When I Get This Close To You,../lyrics/markchesnutt/whenigetthisclosetoyou.html,Rollin' With The Flow,2008,"CHESNUTT, MARK"
(Come On In) The Whiskey's Fine,../lyrics/markchesnutt/comeoninthewhiskeysfine.html,Rollin' With The Flow,2008,"CHESNUTT, MARK"
Woman,../lyrics/markchesnutt/woman.html,Rollin' With The Flow,2008,"CHESNUTT, MARK"
Man In The Mirror,../lyrics/markchesnutt/maninthemirror.html,Rollin' With The Flow,2008,"CHESNUTT, MARK"
Long Way To Go,../lyrics/markchesnutt/longwaytogo.html,Rollin' With The Flow,2008,"CHESNUTT, MARK"
She Never Got Me Over You,../lyrics/markchesnutt/shenevergotmeoveryou.html,Rollin' With The Flow,2008,"CHESNUTT, MARK"
,,Rollin' With The Flow,2008,"CHESNUTT, MARK"
Black Rose,../lyrics/markchesnutt/blackrose.html,Outlaw,2010,"CHESNUTT, MARK"
Whiskey Bent And Hell Bound,../lyrics/markchesnutt/whiskeybentandhellbound.html,Outlaw,2010,"CHESNUTT, MARK"
Only Daddy That'll Walk The Line,../lyrics/markchesnutt/onlydaddythatllwalktheline.html,Outlaw,2010,"CHESNUTT, MARK"
A Couple More Years,../lyrics/markchesnutt/acouplemoreyears.html,Outlaw,2010,"CHESNUTT, MARK"
Need A Little Time Off For Bad Behavior,../lyrics/markchesnutt/needalittletimeoffforbadbehavior.html,Outlaw,2010,"CHESNUTT, MARK"
Sunday Mornin' Comin' Down,../lyrics/markchesnutt/sundaymornincomindown.html,Outlaw,2010,"CHESNUTT, MARK"
Are You Ready For The Country,../lyrics/markchesnutt/areyoureadyforthecountry.html,Outlaw,2010,"CHESNUTT, MARK"
Lovin' Her Was Easier (Than Anything I'll Ever Do Again),../lyrics/markchesnutt/lovinherwaseasierthananythingilleverdoagain.html,Outlaw,2010,"CHESNUTT, MARK"
Country State Of Mind,../lyrics/markchesnutt/countrystateofmind.html,Outlaw,2010,"CHESNUTT, MARK"
Freedom To Stay,../lyrics/markchesnutt/freedomtostay.html,Outlaw,2010,"CHESNUTT, MARK"
Bloody Mary Morning,../lyrics/markchesnutt/bloodymarymorning.html,Outlaw,2010,"CHESNUTT, MARK"
Desperados Waiting For A Train,../lyrics/markchesnutt/desperadoswaitingforatrain.html,Outlaw,2010,"CHESNUTT, MARK"
