song,link,album,year,artist
Splish Splash,../lyrics/bobbydarin/splishsplash.html,Bobby Darin,1958,"DARIN, BOBBY"
Talk To Me Something,../lyrics/bobbydarin/talktomesomething.html,Bobby Darin,1958,"DARIN, BOBBY"
Wear My Ring,../lyrics/bobbydarin/wearmyring.html,Bobby Darin,1958,"DARIN, BOBBY"
Don't Call My Name,../lyrics/bobbydarin/dontcallmyname.html,Bobby Darin,1958,"DARIN, BOBBY"
Brand New House,../lyrics/bobbydarin/brandnewhouse.html,Bobby Darin,1958,"DARIN, BOBBY"
,,Bobby Darin,1958,"DARIN, BOBBY"
Mack The Knife,../lyrics/bobbydarin/macktheknife.html,That's All,1959,"DARIN, BOBBY"
Beyond The Sea,../lyrics/bobbydarin/beyondthesea.html,That's All,1959,"DARIN, BOBBY"
Through A Long And Sleepless Night,../lyrics/bobbydarin/throughalongandsleeplessnight.html,That's All,1959,"DARIN, BOBBY"
"Softly, As In A Morning Sunrise",../lyrics/bobbydarin/softlyasinamorningsunrise.html,That's All,1959,"DARIN, BOBBY"
It Ain't Necessarily So,../lyrics/bobbydarin/itaintnecessarilyso.html,That's All,1959,"DARIN, BOBBY"
I'll Remember April,../lyrics/bobbydarin/illrememberapril.html,That's All,1959,"DARIN, BOBBY"
That's The Way Love Is,../lyrics/bobbydarin/thatsthewayloveis.html,That's All,1959,"DARIN, BOBBY"
Was There A Call For Me,../lyrics/bobbydarin/wasthereacallforme.html,That's All,1959,"DARIN, BOBBY"
Some Of These Days,../lyrics/bobbydarin/someofthesedays.html,That's All,1959,"DARIN, BOBBY"
That's All,../lyrics/bobbydarin/thatsall.html,That's All,1959,"DARIN, BOBBY"
,,That's All,1959,"DARIN, BOBBY"
I Want You With Me,../lyrics/bobbydarin/iwantyouwithme.html,For Teenagers Only,1960,"DARIN, BOBBY"
You Know How,../lyrics/bobbydarin/youknowhow.html,For Teenagers Only,1960,"DARIN, BOBBY"
Somebody To Love,../lyrics/bobbydarin/somebodytolove.html,For Teenagers Only,1960,"DARIN, BOBBY"
Pity Miss Kitty,../lyrics/bobbydarin/pitymisskitty.html,For Teenagers Only,1960,"DARIN, BOBBY"
That Lucky Old Sun,../lyrics/bobbydarin/thatluckyoldsun.html,For Teenagers Only,1960,"DARIN, BOBBY"
"Hush, Somebody's Callin' My Name",../lyrics/bobbydarin/hushsomebodyscallinmyname.html,For Teenagers Only,1960,"DARIN, BOBBY"
,,For Teenagers Only,1960,"DARIN, BOBBY"
Clementine,../lyrics/bobbydarin/clementine.html,This Is Darin,1960,"DARIN, BOBBY"
"Have You Got Any Castles, Baby?",../lyrics/bobbydarin/haveyougotanycastlesbaby.html,This Is Darin,1960,"DARIN, BOBBY"
Don't Dream Of Anybody But Me,../lyrics/bobbydarin/dontdreamofanybodybutme.html,This Is Darin,1960,"DARIN, BOBBY"
Black Coffee,../lyrics/bobbydarin/blackcoffee.html,This Is Darin,1960,"DARIN, BOBBY"
Caravan,../lyrics/bobbydarin/caravan.html,This Is Darin,1960,"DARIN, BOBBY"
Guys And Dolls,../lyrics/bobbydarin/guysanddolls.html,This Is Darin,1960,"DARIN, BOBBY"
Down With Love,../lyrics/bobbydarin/downwithlove.html,This Is Darin,1960,"DARIN, BOBBY"
Pete Kelly's Blues,../lyrics/bobbydarin/petekellysblues.html,This Is Darin,1960,"DARIN, BOBBY"
All Nite Long,../lyrics/bobbydarin/allnitelong.html,This Is Darin,1960,"DARIN, BOBBY"
I Can't Give You Anything But Love,../lyrics/bobbydarin/icantgiveyouanythingbutlove.html,This Is Darin,1960,"DARIN, BOBBY"
,,This Is Darin,1960,"DARIN, BOBBY"
Long Ago And Far Away,../lyrics/bobbydarin/longagoandfaraway.html,Love Swings,1961,"DARIN, BOBBY"
I Didn't Know What Time It Was,../lyrics/bobbydarin/ididntknowwhattimeitwas.html,Love Swings,1961,"DARIN, BOBBY"
How About You,../lyrics/bobbydarin/howaboutyou.html,Love Swings,1961,"DARIN, BOBBY"
The More I See You,../lyrics/bobbydarin/themoreiseeyou.html,Love Swings,1961,"DARIN, BOBBY"
It Had To Be You,../lyrics/bobbydarin/ithadtobeyou.html,Love Swings,1961,"DARIN, BOBBY"
No Greater Love,../lyrics/bobbydarin/nogreaterlove.html,Love Swings,1961,"DARIN, BOBBY"
In Love In Vain,../lyrics/bobbydarin/inloveinvain.html,Love Swings,1961,"DARIN, BOBBY"
Just Friends,../lyrics/bobbydarin/justfriends.html,Love Swings,1961,"DARIN, BOBBY"
Something To Remember You By,../lyrics/bobbydarin/somethingtorememberyouby.html,Love Swings,1961,"DARIN, BOBBY"
Skylark,../lyrics/bobbydarin/skylark.html,Love Swings,1961,"DARIN, BOBBY"
Spring Is Here,../lyrics/bobbydarin/springishere.html,Love Swings,1961,"DARIN, BOBBY"
I Guess I'll Have To Change My Plan,../lyrics/bobbydarin/iguessillhavetochangemyplan.html,Love Swings,1961,"DARIN, BOBBY"
,,Love Swings,1961,"DARIN, BOBBY"
Bullmoose,../lyrics/bobbydarin/bullmoose.html,Twist With Bobby Darin,1961,"DARIN, BOBBY"
Early In The Morning,../lyrics/bobbydarin/earlyinthemorning.html,Twist With Bobby Darin,1961,"DARIN, BOBBY"
Mighty Mighty Man,../lyrics/bobbydarin/mightymightyman.html,Twist With Bobby Darin,1961,"DARIN, BOBBY"
You Know How,../lyrics/bobbydarin/youknowhow.html,Twist With Bobby Darin,1961,"DARIN, BOBBY"
Somebody To Love,../lyrics/bobbydarin/somebodytolove.html,Twist With Bobby Darin,1961,"DARIN, BOBBY"
Multiplication,../lyrics/bobbydarin/multiplication.html,Twist With Bobby Darin,1961,"DARIN, BOBBY"
Irresistible You,../lyrics/bobbydarin/irresistibleyou.html,Twist With Bobby Darin,1961,"DARIN, BOBBY"
Queen Of The Hop,../lyrics/bobbydarin/queenofthehop.html,Twist With Bobby Darin,1961,"DARIN, BOBBY"
You Must Have Been A Beautiful Baby,../lyrics/bobbydarin/youmusthavebeenabeautifulbaby.html,Twist With Bobby Darin,1961,"DARIN, BOBBY"
Pity Miss Kitty,../lyrics/bobbydarin/pitymisskitty.html,Twist With Bobby Darin,1961,"DARIN, BOBBY"
,,Twist With Bobby Darin,1961,"DARIN, BOBBY"
Two Of A Kind,../lyrics/bobbydarin/twoofakind.html,,,"DARIN, BOBBY"
Indiana,../lyrics/bobbydarin/indiana.html,,,"DARIN, BOBBY"
Bob White,../lyrics/bobbydarin/bobwhite.html,,,"DARIN, BOBBY"
Ace In The Hole,../lyrics/bobbydarin/aceinthehole.html,,,"DARIN, BOBBY"
East Of The Rockies,../lyrics/bobbydarin/eastoftherockies.html,,,"DARIN, BOBBY"
If I Had My Druthers,../lyrics/bobbydarin/ifihadmydruthers.html,,,"DARIN, BOBBY"
I Ain't Gonna Give Nobody None Of My Jellyroll,../lyrics/bobbydarin/iaintgonnagivenobodynoneofmyjellyroll.html,,,"DARIN, BOBBY"
Lonesome Polecat,../lyrics/bobbydarin/lonesomepolecat.html,,,"DARIN, BOBBY"
Mississippi Mud,../lyrics/bobbydarin/mississippimud.html,,,"DARIN, BOBBY"
,,,,"DARIN, BOBBY"
What'd I Say,../lyrics/bobbydarin/whatdisay.html,Bobby Darin Sings Ray Charles,1962,"DARIN, BOBBY"
Tell Me How Do You Feel,../lyrics/bobbydarin/tellmehowdoyoufeel.html,Bobby Darin Sings Ray Charles,1962,"DARIN, BOBBY"
My Bonnie,../lyrics/bobbydarin/mybonnie.html,Bobby Darin Sings Ray Charles,1962,"DARIN, BOBBY"
Hallelujah I Love Her So,../lyrics/bobbydarin/hallelujahiloveherso.html,Bobby Darin Sings Ray Charles,1962,"DARIN, BOBBY"
Leave My Woman Alone,../lyrics/bobbydarin/leavemywomanalone.html,Bobby Darin Sings Ray Charles,1962,"DARIN, BOBBY"
Ain't That Love,../lyrics/bobbydarin/aintthatlove.html,Bobby Darin Sings Ray Charles,1962,"DARIN, BOBBY"
Drown In My Own Tears,../lyrics/bobbydarin/drowninmyowntears.html,Bobby Darin Sings Ray Charles,1962,"DARIN, BOBBY"
,,Bobby Darin Sings Ray Charles,1962,"DARIN, BOBBY"
Things,../lyrics/bobbydarin/things.html,Things & Other Things,1962,"DARIN, BOBBY"
I'll Be There,../lyrics/bobbydarin/illbethere.html,Things & Other Things,1962,"DARIN, BOBBY"
Lost Love,../lyrics/bobbydarin/lostlove.html,Things & Other Things,1962,"DARIN, BOBBY"
Look For My True Love,../lyrics/bobbydarin/lookformytruelove.html,Things & Other Things,1962,"DARIN, BOBBY"
Now We're One,../lyrics/bobbydarin/nowwereone.html,Things & Other Things,1962,"DARIN, BOBBY"
Oo-Ee-Train,../lyrics/bobbydarin/ooeetrain.html,Things & Other Things,1962,"DARIN, BOBBY"
"Jailer, Bring Me Water",../lyrics/bobbydarin/jailerbringmewater.html,Things & Other Things,1962,"DARIN, BOBBY"
Nature Boy,../lyrics/bobbydarin/natureboy.html,Things & Other Things,1962,"DARIN, BOBBY"
Sorrow Tomorrow,../lyrics/bobbydarin/sorrowtomorrow.html,Things & Other Things,1962,"DARIN, BOBBY"
,,Things & Other Things,1962,"DARIN, BOBBY"
18 Yellow Roses,../lyrics/bobbydarin/18yellowroses.html,18 Yellow Roses & 11 Other Hits,1963,"DARIN, BOBBY"
On Broadway,../lyrics/bobbydarin/onbroadway.html,18 Yellow Roses & 11 Other Hits,1963,"DARIN, BOBBY"
Not For Me,../lyrics/bobbydarin/notforme.html,18 Yellow Roses & 11 Other Hits,1963,"DARIN, BOBBY"
Can't Get Used To Losing You,../lyrics/bobbydarin/cantgetusedtolosingyou.html,18 Yellow Roses & 11 Other Hits,1963,"DARIN, BOBBY"
Rhythm Of The Rain,../lyrics/bobbydarin/rhythmoftherain.html,18 Yellow Roses & 11 Other Hits,1963,"DARIN, BOBBY"
,,18 Yellow Roses & 11 Other Hits,1963,"DARIN, BOBBY"
It's You Or No One,../lyrics/bobbydarin/itsyouornoone.html,It's You,1963,"DARIN, BOBBY"
I Hadn't Anyone Till You,../lyrics/bobbydarin/ihadntanyonetillyou.html,It's You,1963,"DARIN, BOBBY"
I Can't Believe That You're In Love With Me,../lyrics/bobbydarin/icantbelievethatyoureinlovewithme.html,It's You,1963,"DARIN, BOBBY"
I've Never Been In Love Before,../lyrics/bobbydarin/iveneverbeeninlovebefore.html,It's You,1963,"DARIN, BOBBY"
All Or Nothing At All,../lyrics/bobbydarin/allornothingatall.html,It's You,1963,"DARIN, BOBBY"
Only One Little Item,../lyrics/bobbydarin/onlyonelittleitem.html,It's You,1963,"DARIN, BOBBY"
Don't Get Around Much Anymore,../lyrics/bobbydarin/dontgetaroundmuchanymore.html,It's You,1963,"DARIN, BOBBY"
How About Me,../lyrics/bobbydarin/howaboutme.html,It's You,1963,"DARIN, BOBBY"
I Guess I'm Good For Nothing But The Blues,../lyrics/bobbydarin/iguessimgoodfornothingbuttheblues.html,It's You,1963,"DARIN, BOBBY"
,,It's You,1963,"DARIN, BOBBY"
Sally Was A Good Old Girl,../lyrics/bobbydarin/sallywasagoodoldgirl.html,You're The Reason I'm Living,1963,"DARIN, BOBBY"
(I Heard That) Lonesome Whistle,../lyrics/bobbydarin/iheardthatlonesomewhistle.html,You're The Reason I'm Living,1963,"DARIN, BOBBY"
It Keeps Right On A-Hurtin',../lyrics/bobbydarin/itkeepsrightonahurtin.html,You're The Reason I'm Living,1963,"DARIN, BOBBY"
You're The Reason I'm Living,../lyrics/bobbydarin/yourethereasonimliving.html,You're The Reason I'm Living,1963,"DARIN, BOBBY"
Here I Am,../lyrics/bobbydarin/hereiam.html,You're The Reason I'm Living,1963,"DARIN, BOBBY"
Now You're Gone,../lyrics/bobbydarin/nowyouregone.html,You're The Reason I'm Living,1963,"DARIN, BOBBY"
Release Me,../lyrics/bobbydarin/releaseme.html,You're The Reason I'm Living,1963,"DARIN, BOBBY"
,,You're The Reason I'm Living,1963,"DARIN, BOBBY"
"Hello, Dolly!",../lyrics/bobbydarin/hellodolly.html,From Hello Dolly To Goodbye Charlie,1964,"DARIN, BOBBY"
Call Me Irresponsible,../lyrics/bobbydarin/callmeirresponsible.html,From Hello Dolly To Goodbye Charlie,1964,"DARIN, BOBBY"
Days Of Wine And Roses,../lyrics/bobbydarin/daysofwineandroses.html,From Hello Dolly To Goodbye Charlie,1964,"DARIN, BOBBY"
More,../lyrics/bobbydarin/more.html,From Hello Dolly To Goodbye Charlie,1964,"DARIN, BOBBY"
The End Of Never,../lyrics/bobbydarin/theendofnever.html,From Hello Dolly To Goodbye Charlie,1964,"DARIN, BOBBY"
Charade,../lyrics/bobbydarin/charade.html,From Hello Dolly To Goodbye Charlie,1964,"DARIN, BOBBY"
Once In A Lifetime,../lyrics/bobbydarin/onceinalifetime.html,From Hello Dolly To Goodbye Charlie,1964,"DARIN, BOBBY"
Sunday In New York,../lyrics/bobbydarin/sundayinnewyork.html,From Hello Dolly To Goodbye Charlie,1964,"DARIN, BOBBY"
Look At Me,../lyrics/bobbydarin/lookatme.html,From Hello Dolly To Goodbye Charlie,1964,"DARIN, BOBBY"
"Goodbye, Charlie",../lyrics/bobbydarin/goodbyecharlie.html,From Hello Dolly To Goodbye Charlie,1964,"DARIN, BOBBY"
,,From Hello Dolly To Goodbye Charlie,1964,"DARIN, BOBBY"
Between The Devil And The Deep Blue Sea,../lyrics/bobbydarin/betweenthedevilandthedeepbluesea.html,Winners,1964,"DARIN, BOBBY"
Do Nothin' Till You Hear From Me,../lyrics/bobbydarin/donothintillyouhearfromme.html,Winners,1964,"DARIN, BOBBY"
Golden Earrings,../lyrics/bobbydarin/goldenearrings.html,Winners,1964,"DARIN, BOBBY"
When Day Is Done,../lyrics/bobbydarin/whendayisdone.html,Winners,1964,"DARIN, BOBBY"
What A Difference A Day Makes,../lyrics/bobbydarin/whatadifferenceadaymakes.html,Winners,1964,"DARIN, BOBBY"
What Can I Say After I'm Sorry,../lyrics/bobbydarin/whatcanisayafterimsorry.html,Winners,1964,"DARIN, BOBBY"
Hard Hearted Hannah,../lyrics/bobbydarin/hardheartedhannah.html,Winners,1964,"DARIN, BOBBY"
Easy Living,../lyrics/bobbydarin/easyliving.html,Winners,1964,"DARIN, BOBBY"
They All Laughed,../lyrics/bobbydarin/theyalllaughed.html,Winners,1964,"DARIN, BOBBY"
,,Winners,1964,"DARIN, BOBBY"
Venice Blue,../lyrics/bobbydarin/veniceblue.html,Venice Blue,1965,"DARIN, BOBBY"
I Wanna Be Around,../lyrics/bobbydarin/iwannabearound.html,Venice Blue,1965,"DARIN, BOBBY"
Somewhere,../lyrics/bobbydarin/somewhere.html,Venice Blue,1965,"DARIN, BOBBY"
The Good Life,../lyrics/bobbydarin/thegoodlife.html,Venice Blue,1965,"DARIN, BOBBY"
Dear Heart,../lyrics/bobbydarin/dearheart.html,Venice Blue,1965,"DARIN, BOBBY"
"Softly, As I Leave You",../lyrics/bobbydarin/softlyasileaveyou.html,Venice Blue,1965,"DARIN, BOBBY"
You Just Don't Know,../lyrics/bobbydarin/youjustdontknow.html,Venice Blue,1965,"DARIN, BOBBY"
Who Can I Turn To?,../lyrics/bobbydarin/whocaniturnto.html,Venice Blue,1965,"DARIN, BOBBY"
A Taste Of Honey,../lyrics/bobbydarin/atasteofhoney.html,Venice Blue,1965,"DARIN, BOBBY"
,,Venice Blue,1965,"DARIN, BOBBY"
If I Were A Carpenter,../lyrics/bobbydarin/ifiwereacarpenter.html,If I Were A Carpenter,1966,"DARIN, BOBBY"
Reason To Believe,../lyrics/bobbydarin/reasontobelieve.html,If I Were A Carpenter,1966,"DARIN, BOBBY"
Misty Roses,../lyrics/bobbydarin/mistyroses.html,If I Were A Carpenter,1966,"DARIN, BOBBY"
Until It's Time For You To Go,../lyrics/bobbydarin/untilitstimeforyoutogo.html,If I Were A Carpenter,1966,"DARIN, BOBBY"
The Girl Who Stood Beside Me,../lyrics/bobbydarin/thegirlwhostoodbesideme.html,If I Were A Carpenter,1966,"DARIN, BOBBY"
Red Balloon,../lyrics/bobbydarin/redballoon.html,If I Were A Carpenter,1966,"DARIN, BOBBY"
Amy,../lyrics/bobbydarin/amy.html,If I Were A Carpenter,1966,"DARIN, BOBBY"
Daydream,../lyrics/bobbydarin/daydream.html,If I Were A Carpenter,1966,"DARIN, BOBBY"
,,If I Were A Carpenter,1966,"DARIN, BOBBY"
When I Look In Your Eyes,../lyrics/bobbydarin/whenilookinyoureyes.html,Bobby Darin Sings Doctor Doolittle,1967,"DARIN, BOBBY"
Something In Your Smile,../lyrics/bobbydarin/somethinginyoursmile.html,Bobby Darin Sings Doctor Doolittle,1967,"DARIN, BOBBY"
Fabulous Places,../lyrics/bobbydarin/fabulousplaces.html,Bobby Darin Sings Doctor Doolittle,1967,"DARIN, BOBBY"
Beautiful Things,../lyrics/bobbydarin/beautifulthings.html,Bobby Darin Sings Doctor Doolittle,1967,"DARIN, BOBBY"
Talk To The Animals,../lyrics/bobbydarin/talktotheanimals.html,Bobby Darin Sings Doctor Doolittle,1967,"DARIN, BOBBY"
,,Bobby Darin Sings Doctor Doolittle,1967,"DARIN, BOBBY"
Don't Rain On My Parade,../lyrics/bobbydarin/dontrainonmyparade.html,Something Special,1967,"DARIN, BOBBY"
About A Quarter To Nine,../lyrics/bobbydarin/aboutaquartertonine.html,Something Special,1967,"DARIN, BOBBY"
Once Upon A Time,../lyrics/bobbydarin/onceuponatime.html,Something Special,1967,"DARIN, BOBBY"
I Wish I Were In Love Again,../lyrics/bobbydarin/iwishiwereinloveagain.html,Something Special,1967,"DARIN, BOBBY"
Mack The Knife,../lyrics/bobbydarin/macktheknife.html,Something Special,1967,"DARIN, BOBBY"
Funny What Love Can Do,../lyrics/bobbydarin/funnywhatlovecando.html,Something Special,1967,"DARIN, BOBBY"
What'd I Say,../lyrics/bobbydarin/whatdisay.html,Something Special,1967,"DARIN, BOBBY"
That's All,../lyrics/bobbydarin/thatsall.html,Something Special,1967,"DARIN, BOBBY"
,,Something Special,1967,"DARIN, BOBBY"
Questions,../lyrics/bobbydarin/questions.html,Bobby Darin Born Walden Robert Cassotto,1968,"DARIN, BOBBY"
Jingle Jangle Jungle,../lyrics/bobbydarin/jinglejanglejungle.html,Bobby Darin Born Walden Robert Cassotto,1968,"DARIN, BOBBY"
The Proper Gander,../lyrics/bobbydarin/thepropergander.html,Bobby Darin Born Walden Robert Cassotto,1968,"DARIN, BOBBY"
Bullfrog,../lyrics/bobbydarin/bullfrog.html,Bobby Darin Born Walden Robert Cassotto,1968,"DARIN, BOBBY"
Long Line Rider,../lyrics/bobbydarin/longlinerider.html,Bobby Darin Born Walden Robert Cassotto,1968,"DARIN, BOBBY"
Change,../lyrics/bobbydarin/change.html,Bobby Darin Born Walden Robert Cassotto,1968,"DARIN, BOBBY"
I Can See The Wind,../lyrics/bobbydarin/icanseethewind.html,Bobby Darin Born Walden Robert Cassotto,1968,"DARIN, BOBBY"
Sunday,../lyrics/bobbydarin/sunday.html,Bobby Darin Born Walden Robert Cassotto,1968,"DARIN, BOBBY"
In Memoriam,../lyrics/bobbydarin/inmemoriam.html,Bobby Darin Born Walden Robert Cassotto,1968,"DARIN, BOBBY"
,,Bobby Darin Born Walden Robert Cassotto,1968,"DARIN, BOBBY"
I Got Rhythm,../lyrics/bobbydarin/igotrhythm.html,The Swinging Side Of Bobby Darin,2005,"DARIN, BOBBY"
I'm Beginning To See The Light,../lyrics/bobbydarin/imbeginningtoseethelight.html,The Swinging Side Of Bobby Darin,2005,"DARIN, BOBBY"
I'm Sitting On Top Of The World,../lyrics/bobbydarin/imsittingontopoftheworld.html,The Swinging Side Of Bobby Darin,2005,"DARIN, BOBBY"
There's A Rainbow 'Round My Shoulder,../lyrics/bobbydarin/theresarainbowroundmyshoulder.html,The Swinging Side Of Bobby Darin,2005,"DARIN, BOBBY"
Fly Me To The Moon,../lyrics/bobbydarin/flymetothemoon.html,The Swinging Side Of Bobby Darin,2005,"DARIN, BOBBY"
All Of You,../lyrics/bobbydarin/allofyou.html,The Swinging Side Of Bobby Darin,2005,"DARIN, BOBBY"
Hello Young Lovers,../lyrics/bobbydarin/helloyounglovers.html,The Swinging Side Of Bobby Darin,2005,"DARIN, BOBBY"
Just In Time,../lyrics/bobbydarin/justintime.html,The Swinging Side Of Bobby Darin,2005,"DARIN, BOBBY"
This Nearly Was Mine,../lyrics/bobbydarin/thisnearlywasmine.html,The Swinging Side Of Bobby Darin,2005,"DARIN, BOBBY"
Make Someone Happy,../lyrics/bobbydarin/makesomeonehappy.html,The Swinging Side Of Bobby Darin,2005,"DARIN, BOBBY"
I Wanna Be Around,../lyrics/bobbydarin/iwannabearound.html,The Swinging Side Of Bobby Darin,2005,"DARIN, BOBBY"
On The Street Where You Live,../lyrics/bobbydarin/onthestreetwhereyoulive.html,The Swinging Side Of Bobby Darin,2005,"DARIN, BOBBY"
The Good Life,../lyrics/bobbydarin/thegoodlife.html,The Swinging Side Of Bobby Darin,2005,"DARIN, BOBBY"
(Your Love Keeps Lifting Me) Higher And Higher,../lyrics/bobbydarin/yourlovekeepsliftingmehigherandhigher.html,,,"DARIN, BOBBY"
A Nightingale Sang In Berkeley Square,../lyrics/bobbydarin/anightingalesanginberkeleysquare.html,,,"DARIN, BOBBY"
Artificial Flowers,../lyrics/bobbydarin/artificialflowers.html,,,"DARIN, BOBBY"
As Long As I'm Singing,../lyrics/bobbydarin/aslongasimsinging.html,,,"DARIN, BOBBY"
Dream Lover,../lyrics/bobbydarin/dreamlover.html,,,"DARIN, BOBBY"
If A Man Answers,../lyrics/bobbydarin/ifamananswers.html,,,"DARIN, BOBBY"
Moon River,../lyrics/bobbydarin/moonriver.html,,,"DARIN, BOBBY"
Oh! Look At Me Now,../lyrics/bobbydarin/ohlookatmenow.html,,,"DARIN, BOBBY"
She Knows,../lyrics/bobbydarin/sheknows.html,,,"DARIN, BOBBY"
The Curtain Falls,../lyrics/bobbydarin/thecurtainfalls.html,,,"DARIN, BOBBY"
You'll Never Know,../lyrics/bobbydarin/youllneverknow.html,,,"DARIN, BOBBY"
