song,link,album,year,artist
What Made You Say That?,../lyrics/shaniatwain/whatmadeyousaythat.html,Shania Twain,1993,"TWAIN, SHANIA"
You Lay A Whole Lot Of Love On Me,../lyrics/shaniatwain/youlayawholelotofloveonme.html,Shania Twain,1993,"TWAIN, SHANIA"
Dance With The One That Brought You,../lyrics/shaniatwain/dancewiththeonethatbroughtyou.html,Shania Twain,1993,"TWAIN, SHANIA"
Still Under The Weather,../lyrics/shaniatwain/stillundertheweather.html,Shania Twain,1993,"TWAIN, SHANIA"
God Ain't Gonna Getcha For That,../lyrics/shaniatwain/godaintgonnagetchaforthat.html,Shania Twain,1993,"TWAIN, SHANIA"
Got A Hold On Me,../lyrics/shaniatwain/gotaholdonme.html,Shania Twain,1993,"TWAIN, SHANIA"
There Goes The Neighborhood,../lyrics/shaniatwain/theregoestheneighborhood.html,Shania Twain,1993,"TWAIN, SHANIA"
Forget Me,../lyrics/shaniatwain/forgetme.html,Shania Twain,1993,"TWAIN, SHANIA"
When He Leaves You,../lyrics/shaniatwain/whenheleavesyou.html,Shania Twain,1993,"TWAIN, SHANIA"
Crime Of The Century,../lyrics/shaniatwain/crimeofthecentury.html,Shania Twain,1993,"TWAIN, SHANIA"
,,Shania Twain,1993,"TWAIN, SHANIA"
Home Ain't Where His Heart Is Anymore,../lyrics/shaniatwain/homeaintwherehisheartisanymore.html,The Woman In Me,1995,"TWAIN, SHANIA"
Any Man Of Mine,../lyrics/shaniatwain/anymanofmine.html,The Woman In Me,1995,"TWAIN, SHANIA"
Whose Bed Have Your Boots Been Under?,../lyrics/shaniatwain/whosebedhaveyourbootsbeenunder.html,The Woman In Me,1995,"TWAIN, SHANIA"
If You're Not In it For Love (I'm Outta Here),../lyrics/shaniatwain/ifyourenotinitforloveimouttahere.html,The Woman In Me,1995,"TWAIN, SHANIA"
The Woman In Me (Needs The Man In You),../lyrics/shaniatwain/thewomaninmeneedsthemaninyou.html,The Woman In Me,1995,"TWAIN, SHANIA"
Is There Life After Love?,../lyrics/shaniatwain/istherelifeafterlove.html,The Woman In Me,1995,"TWAIN, SHANIA"
If It Don't Take Two,../lyrics/shaniatwain/ifitdonttaketwo.html,The Woman In Me,1995,"TWAIN, SHANIA"
You Win My Love,../lyrics/shaniatwain/youwinmylove.html,The Woman In Me,1995,"TWAIN, SHANIA"
Raining On Our Love,../lyrics/shaniatwain/rainingonourlove.html,The Woman In Me,1995,"TWAIN, SHANIA"
Leaving Is The Only Way Out,../lyrics/shaniatwain/leavingistheonlywayout.html,The Woman In Me,1995,"TWAIN, SHANIA"
No One Needs To Know,../lyrics/shaniatwain/nooneneedstoknow.html,The Woman In Me,1995,"TWAIN, SHANIA"
God Bless The Child,../lyrics/shaniatwain/godblessthechild.html,The Woman In Me,1995,"TWAIN, SHANIA"
God Bless The Child (Extended Remix),../lyrics/shaniatwain/godblessthechildextendedremix.html,The Woman In Me,1995,"TWAIN, SHANIA"
,,The Woman In Me,1995,"TWAIN, SHANIA"
Man! I Feel Like A Woman!,../lyrics/shaniatwain/manifeellikeawoman.html,Come On Over,1997,"TWAIN, SHANIA"
I'm Holdin' On To Love (To Save My Life),../lyrics/shaniatwain/imholdinontolovetosavemylife.html,Come On Over,1997,"TWAIN, SHANIA"
Love Gets Me Every Time,../lyrics/shaniatwain/lovegetsmeeverytime.html,Come On Over,1997,"TWAIN, SHANIA"
Don't Be Stupid (You Know I Love You),../lyrics/shaniatwain/dontbestupidyouknowiloveyou.html,Come On Over,1997,"TWAIN, SHANIA"
From This Moment On,../lyrics/shaniatwain/fromthismomenton.html,Come On Over,1997,"TWAIN, SHANIA"
Come On Over,../lyrics/shaniatwain/comeonover.html,Come On Over,1997,"TWAIN, SHANIA"
When,../lyrics/shaniatwain/when.html,Come On Over,1997,"TWAIN, SHANIA"
Whatever You Do! Don't!,../lyrics/shaniatwain/whateveryoudodont.html,Come On Over,1997,"TWAIN, SHANIA"
"If You Wanna Touch Her, Ask!",../lyrics/shaniatwain/ifyouwannatouchherask.html,Come On Over,1997,"TWAIN, SHANIA"
You're Still The One,../lyrics/shaniatwain/yourestilltheone.html,Come On Over,1997,"TWAIN, SHANIA"
"Honey, I'm Home",../lyrics/shaniatwain/honeyimhome.html,Come On Over,1997,"TWAIN, SHANIA"
That Don't Impress Me Much,../lyrics/shaniatwain/thatdontimpressmemuch.html,Come On Over,1997,"TWAIN, SHANIA"
"Black Eyes, Blue Tears",../lyrics/shaniatwain/blackeyesbluetears.html,Come On Over,1997,"TWAIN, SHANIA"
I Won't Leave You Lonely,../lyrics/shaniatwain/iwontleaveyoulonely.html,Come On Over,1997,"TWAIN, SHANIA"
Rock This Country!,../lyrics/shaniatwain/rockthiscountry.html,Come On Over,1997,"TWAIN, SHANIA"
You've Got A Way,../lyrics/shaniatwain/youvegotaway.html,Come On Over,1997,"TWAIN, SHANIA"
,,Come On Over,1997,"TWAIN, SHANIA"
Up!,../lyrics/shaniatwain/up.html,Up!,2002,"TWAIN, SHANIA"
I'm Gonna Getcha Good!,../lyrics/shaniatwain/imgonnagetchagood.html,Up!,2002,"TWAIN, SHANIA"
She's Not Just A Pretty Face,../lyrics/shaniatwain/shesnotjustaprettyface.html,Up!,2002,"TWAIN, SHANIA"
Juanita,../lyrics/shaniatwain/juanita.html,Up!,2002,"TWAIN, SHANIA"
Forever And For Always,../lyrics/shaniatwain/foreverandforalways.html,Up!,2002,"TWAIN, SHANIA"
Ain't No Particular Way,../lyrics/shaniatwain/aintnoparticularway.html,Up!,2002,"TWAIN, SHANIA"
It Only Hurts When I'm Breathing,../lyrics/shaniatwain/itonlyhurtswhenimbreathing.html,Up!,2002,"TWAIN, SHANIA"
Nah!,../lyrics/shaniatwain/nah.html,Up!,2002,"TWAIN, SHANIA"
(Wanna Get To Know You) That Good!,../lyrics/shaniatwain/wannagettoknowyouthatgood.html,Up!,2002,"TWAIN, SHANIA"
C'est La Vie,../lyrics/shaniatwain/cestlavie.html,Up!,2002,"TWAIN, SHANIA"
I'm Jealous,../lyrics/shaniatwain/imjealous.html,Up!,2002,"TWAIN, SHANIA"
Ka-Ching,../lyrics/shaniatwain/kaching.html,Up!,2002,"TWAIN, SHANIA"
Thank You Baby! (For Makin' Someday Come So Soon),../lyrics/shaniatwain/thankyoubabyformakinsomedaycomesosoon.html,Up!,2002,"TWAIN, SHANIA"
Waiter! Bring Me Water!,../lyrics/shaniatwain/waiterbringmewater.html,Up!,2002,"TWAIN, SHANIA"
What A Way To Wanna Be!,../lyrics/shaniatwain/whatawaytowannabe.html,Up!,2002,"TWAIN, SHANIA"
I Ain't Goin' Down,../lyrics/shaniatwain/iaintgoindown.html,Up!,2002,"TWAIN, SHANIA"
I'm Not In The Mood (To Say No)!,../lyrics/shaniatwain/imnotinthemoodtosayno.html,Up!,2002,"TWAIN, SHANIA"
In My Car (I'll Be The Driver),../lyrics/shaniatwain/inmycarillbethedriver.html,Up!,2002,"TWAIN, SHANIA"
When You Kiss Me,../lyrics/shaniatwain/whenyoukissme.html,Up!,2002,"TWAIN, SHANIA"
,,Up!,2002,"TWAIN, SHANIA"
Wild And Wicked,../lyrics/shaniatwain/wildandwicked.html,Send It With Love,2005,"TWAIN, SHANIA"
Two Hearts One Love,../lyrics/shaniatwain/twoheartsonelove.html,Send It With Love,2005,"TWAIN, SHANIA"
Lost My Heart,../lyrics/shaniatwain/lostmyheart.html,Send It With Love,2005,"TWAIN, SHANIA"
Bite My Lip,../lyrics/shaniatwain/bitemylip.html,Send It With Love,2005,"TWAIN, SHANIA"
(Don't Gimme That) Once Over,../lyrics/shaniatwain/dontgimmethatonceover.html,Send It With Love,2005,"TWAIN, SHANIA"
Hate To Love,../lyrics/shaniatwain/hatetolove.html,Send It With Love,2005,"TWAIN, SHANIA"
Send It With Love,../lyrics/shaniatwain/senditwithlove.html,Send It With Love,2005,"TWAIN, SHANIA"
Luv Eyes,../lyrics/shaniatwain/luveyes.html,Send It With Love,2005,"TWAIN, SHANIA"
Rhythm Made Me Do It,../lyrics/shaniatwain/rhythmmademedoit.html,Send It With Love,2005,"TWAIN, SHANIA"
Half Breed,../lyrics/shaniatwain/halfbreed.html,Send It With Love,2005,"TWAIN, SHANIA"
It's Alright,../lyrics/shaniatwain/itsalright.html,Send It With Love,2005,"TWAIN, SHANIA"
Love,../lyrics/shaniatwain/love.html,Send It With Love,2005,"TWAIN, SHANIA"
I Ain't Gonna Eat Out My Heart Anymore,../lyrics/shaniatwain/iaintgonnaeatoutmyheartanymore.html,Send It With Love,2005,"TWAIN, SHANIA"
"All Fired Up, No Place To Go",../lyrics/shaniatwain/allfiredupnoplacetogo.html,Send It With Love,2005,"TWAIN, SHANIA"
The Heart Is Blind,../lyrics/shaniatwain/theheartisblind.html,Send It With Love,2005,"TWAIN, SHANIA"
For The Love Of Him,../lyrics/shaniatwain/fortheloveofhim.html,Send It With Love,2005,"TWAIN, SHANIA"
Don't!,../lyrics/shaniatwain/dont.html,,,"TWAIN, SHANIA"
I Ain't No Quitter,../lyrics/shaniatwain/iaintnoquitter.html,,,"TWAIN, SHANIA"
Party For Two,../lyrics/shaniatwain/partyfortwo.html,,,"TWAIN, SHANIA"
Shoes,../lyrics/shaniatwain/shoes.html,,,"TWAIN, SHANIA"
Today Is Your Day,../lyrics/shaniatwain/todayisyourday.html,,,"TWAIN, SHANIA"
